{
  "contract_version": "1.0.0",
  "source_id": "synthetic-publication",
  "registry_version": 1,
  "observed_at": "2026-09-30T08:00:00Z",
  "last_fetch_success_at": "2026-09-30T08:00:00Z",
  "last_item_observed_at": null,
  "coverage_start_at": null,
  "coverage_end_at": null,
  "parser_version": "fixture-parser-v1",
  "fetch_version": "fixture-fetch-v1",
  "state": "quiet",
  "failure_category": null,
  "consecutive_failures": 0,
  "accepted_items": 0,
  "rejected_items": 0,
  "policy_ref": null,
  "next_safe_action": "wait-for-approved-poll",
  "diagnostic_code": null
}
